{
  "schema_version": 1,
  "run_id": "eval-20260503T120705Z-agentops-core.goals-autodev-evolve",
  "suite": {
    "id": "agentops-core.goals-autodev-evolve",
    "path": "/home/boful/dev/personal/agentops/evals/agentops-core/goals-autodev-evolve.json",
    "visibility": "public_canary",
    "tier": "deterministic",
    "sha256": "ba1c688c984c90c7bb1e094843874f5ef4323cb652c302c5303b2a31215b3087"
  },
  "started_at": "2026-05-03T12:07:05.535975014Z",
  "completed_at": "2026-05-03T12:07:07.120090187Z",
  "status": "pass",
  "verdict": "pass",
  "git": {
    "candidate_ref": "main",
    "candidate_sha": "ad754badb8f3",
    "dirty": true,
    "dirty_paths": [
      ".agents/rpi/next-work.jsonl"
    ]
  },
  "runtime": {
    "name": "shell",
    "live": false,
    "attempts": 1,
    "timeout_seconds": 120
  },
  "environment": {
    "scrubbed_env_prefixes": [
      "AGENTOPS_RPI_RUNTIME",
      "ANTHROPIC_",
      "OPENAI_"
    ],
    "isolated_home": false,
    "isolated_codex_home": false,
    "network_access": "disabled"
  },
  "baseline": {
    "mode": "promote",
    "baseline_run_id": "eval-20260503T120705Z-agentops-core.goals-autodev-evolve",
    "baseline_path": "/home/boful/dev/personal/agentops/.agents/evals/baselines/agentops-core.goals-autodev-evolve.baseline.json",
    "promoted_from_run_id": "eval-20260503T120705Z-agentops-core.goals-autodev-evolve",
    "promoted_at": "2026-05-03T12:13:50.187726172Z",
    "promoted_by": "evolve-cycle-16",
    "rationale": "bulk catch-up after suite-definition drift accumulated through 2026-04-25 to 2026-05-03; all 57 suites verified passing in mid-baseline pass; cycles 14+15 fixed the 3 prior outliers (skill-catalog, eval-runner-cli-docs, distribution-install-update transitive)"
  },
  "case_results": [
    {
      "id": "goals-autodev-evolve-focused-tests",
      "status": "pass",
      "score": 1,
      "dimension_scores": {
        "correctness": 1,
        "learning_closure": 1,
        "runtime_compatibility": 1
      },
      "duration_ms": 645,
      "critical": true,
      "diagnostics": [
        "exit_code matched 0",
        "stdout contains \"ok  \\tgithub.com/boshu2/agentops/cli/cmd/ao\""
      ]
    },
    {
      "id": "repo-fitness-contract-smoke",
      "status": "pass",
      "score": 1,
      "dimension_scores": {
        "correctness": 1,
        "process_adherence": 1,
        "runtime_compatibility": 1
      },
      "duration_ms": 936,
      "critical": true,
      "diagnostics": [
        "exit_code matched 0",
        "stdout contains \"Evolve loop finished\""
      ]
    },
    {
      "id": "fitness-operator-skill-contracts",
      "status": "pass",
      "score": 1,
      "dimension_scores": {
        "artifact_quality": 1,
        "learning_closure": 1,
        "process_adherence": 1
      },
      "critical": true,
      "diagnostics": [
        "artifact ../../skills/goals/SKILL.md contains \"ao goals measure --json\"",
        "artifact ../../skills/goals/SKILL.md contains \"When both files exist, GOALS.md takes precedence.\"",
        "artifact ../../skills/autodev/SKILL.md contains \"`PROGRAM.md` takes precedence over `AUTODEV.md`.\"",
        "artifact ../../skills/autodev/SKILL.md contains \"Do not mark an autonomous cycle successful only because the main tests pass.\"",
        "artifact ../../skills/evolve/SKILL.md contains \"Failing goals and directive gaps\"",
        "artifact ../../skills/evolve/SKILL.md contains \"Testing improvements\""
      ]
    },
    {
      "id": "autodev-contract-doc-required-sections",
      "status": "pass",
      "score": 1,
      "dimension_scores": {
        "artifact_quality": 1,
        "process_adherence": 1
      },
      "diagnostics": [
        "artifact ../../docs/contracts/autodev-program.md contains \"### `Objective`\"",
        "artifact ../../docs/contracts/autodev-program.md contains \"### `Mutable Scope`\"",
        "artifact ../../docs/contracts/autodev-program.md contains \"### `Immutable Scope`\"",
        "artifact ../../docs/contracts/autodev-program.md contains \"### `Validation Commands`\"",
        "artifact ../../docs/contracts/autodev-program.md contains \"## Evolve Integration\"",
        "artifact ../../PROGRAM.md contains \"## Validation Commands\""
      ]
    },
    {
      "id": "cli-docs-expose-fitness-commands",
      "status": "pass",
      "score": 1,
      "dimension_scores": {
        "artifact_quality": 1,
        "process_adherence": 1,
        "runtime_compatibility": 1
      },
      "duration_ms": 1,
      "diagnostics": [
        "artifact ../../cli/docs/COMMANDS.md contains \"### `ao goals`\"",
        "artifact ../../cli/docs/COMMANDS.md contains \"### `ao autodev`\"",
        "artifact ../../cli/docs/COMMANDS.md contains \"### `ao evolve`\"",
        "artifact ../../cli/docs/COMMANDS.md contains \"Track, measure, and validate project fitness goals.\"",
        "artifact ../../cli/docs/COMMANDS.md contains \"Run the v2 autonomous improvement loop.\""
      ]
    },
    {
      "id": "evolve-code-defaults",
      "status": "pass",
      "score": 1,
      "dimension_scores": {
        "artifact_quality": 1,
        "correctness": 1,
        "process_adherence": 1
      },
      "diagnostics": [
        "artifact ../../cli/cmd/ao/evolve.go contains \"applyEvolveDefaults(cmd)\"",
        "artifact ../../cli/cmd/ao/evolve.go contains \"rpiSupervisor = true\"",
        "artifact ../../cli/cmd/ao/evolve.go contains \"ensureEvolveEraBaseline(cwd)\"",
        "artifact ../../cli/cmd/ao/evolve.go contains \"return runRPILoop(cmd, args)\""
      ]
    }
  ],
  "aggregate_score": 1,
  "dimension_scores": {
    "artifact_quality": 1,
    "correctness": 1,
    "learning_closure": 1,
    "process_adherence": 1,
    "runtime_compatibility": 1
  },
  "artifacts": [
    {
      "path": ".agents/evolve/baselines/20260503T120414Z-mid/goals-autodev-evolve.json",
      "purpose": "evaluation run record",
      "kind": "run_json"
    },
    {
      "path": "/home/boful/dev/personal/agentops/.agents/evals/baselines/agentops-core.goals-autodev-evolve.baseline.json",
      "purpose": "promoted eval baseline",
      "kind": "baseline"
    }
  ]
}
