{
  "schema_version": 1,
  "run_id": "eval-20260503T120514Z-agentops-core.cli-contracts",
  "suite": {
    "id": "agentops-core.cli-contracts",
    "path": "/home/boful/dev/personal/agentops/evals/agentops-core/cli-contracts.json",
    "visibility": "public_canary",
    "tier": "deterministic",
    "sha256": "bd6830efc2e16ebf8a0ab276ec9b83dfa71b22e7964a2cd60d8f0096b824ad04"
  },
  "started_at": "2026-05-03T12:05:14.070129591Z",
  "completed_at": "2026-05-03T12:05:24.838118111Z",
  "status": "pass",
  "verdict": "pass",
  "git": {
    "candidate_ref": "main",
    "candidate_sha": "ad754badb8f3",
    "dirty": true,
    "dirty_paths": [
      ".agents/rpi/next-work.jsonl"
    ]
  },
  "runtime": {
    "name": "shell",
    "live": false,
    "attempts": 1,
    "timeout_seconds": 90
  },
  "environment": {
    "scrubbed_env_prefixes": [
      "AGENTOPS_RPI_RUNTIME",
      "ANTHROPIC_",
      "OPENAI_"
    ],
    "isolated_home": false,
    "isolated_codex_home": false,
    "network_access": "disabled"
  },
  "baseline": {
    "mode": "promote",
    "baseline_run_id": "eval-20260503T120514Z-agentops-core.cli-contracts",
    "baseline_path": "/home/boful/dev/personal/agentops/.agents/evals/baselines/agentops-core.cli-contracts.baseline.json",
    "promoted_from_run_id": "eval-20260503T120514Z-agentops-core.cli-contracts",
    "promoted_at": "2026-05-03T12:13:49.313035778Z",
    "promoted_by": "evolve-cycle-16",
    "rationale": "bulk catch-up after suite-definition drift accumulated through 2026-04-25 to 2026-05-03; all 57 suites verified passing in mid-baseline pass; cycles 14+15 fixed the 3 prior outliers (skill-catalog, eval-runner-cli-docs, distribution-install-update transitive)"
  },
  "case_results": [
    {
      "id": "cli-reference-current",
      "status": "pass",
      "score": 1,
      "dimension_scores": {
        "artifact_quality": 1,
        "correctness": 1
      },
      "duration_ms": 10743,
      "critical": true,
      "diagnostics": [
        "exit_code matched 0"
      ]
    },
    {
      "id": "cli-skills-map-current",
      "status": "pass",
      "score": 1,
      "dimension_scores": {
        "correctness": 1,
        "process_adherence": 1
      },
      "duration_ms": 23,
      "critical": true,
      "diagnostics": [
        "exit_code matched 0"
      ]
    },
    {
      "id": "json-flag-ci-gate",
      "status": "pass",
      "score": 1,
      "dimension_scores": {
        "artifact_quality": 1,
        "runtime_compatibility": 1
      },
      "critical": true,
      "diagnostics": [
        "artifact ../../.github/workflows/validate.yml contains \"json-flag-consistency\"",
        "artifact ../../.github/workflows/validate.yml contains \"tests/cli/test-json-flag-consistency.sh\""
      ]
    },
    {
      "id": "eval-command-documented",
      "status": "pass",
      "score": 1,
      "dimension_scores": {
        "artifact_quality": 1,
        "process_adherence": 1
      },
      "diagnostics": [
        "artifact ../../cli/docs/COMMANDS.md contains \"### `ao eval`\"",
        "artifact ../../cli/docs/COMMANDS.md contains \"#### `ao eval scorecard`\""
      ]
    }
  ],
  "aggregate_score": 1,
  "dimension_scores": {
    "artifact_quality": 1,
    "correctness": 1,
    "process_adherence": 1,
    "runtime_compatibility": 1
  },
  "artifacts": [
    {
      "path": ".agents/evolve/baselines/20260503T120414Z-mid/cli-contracts.json",
      "purpose": "evaluation run record",
      "kind": "run_json"
    },
    {
      "path": "/home/boful/dev/personal/agentops/.agents/evals/baselines/agentops-core.cli-contracts.baseline.json",
      "purpose": "promoted eval baseline",
      "kind": "baseline"
    }
  ]
}
