{
  "schema_version": 1,
  "run_id": "eval-20260503T120838Z-agentops-core.hook-manifest-runtime-contracts",
  "suite": {
    "id": "agentops-core.hook-manifest-runtime-contracts",
    "path": "/home/boful/dev/personal/agentops/evals/agentops-core/hook-manifest-runtime-contracts.json",
    "visibility": "public_canary",
    "tier": "deterministic",
    "sha256": "7ae870e8f9e0e8f8cbae702edcd2bb81cc7c72935c97c10c891041f33eb3c319"
  },
  "started_at": "2026-05-03T12:08:38.316794509Z",
  "completed_at": "2026-05-03T12:08:52.611745009Z",
  "status": "pass",
  "verdict": "pass",
  "git": {
    "candidate_ref": "main",
    "candidate_sha": "ad754badb8f3",
    "dirty": true,
    "dirty_paths": [
      ".agents/rpi/next-work.jsonl"
    ]
  },
  "runtime": {
    "name": "shell",
    "live": false,
    "attempts": 1,
    "timeout_seconds": 180
  },
  "environment": {
    "scrubbed_env_prefixes": [
      "AGENTOPS_RPI_RUNTIME",
      "ANTHROPIC_",
      "OPENAI_"
    ],
    "isolated_home": false,
    "isolated_codex_home": false,
    "network_access": "disabled"
  },
  "baseline": {
    "mode": "promote",
    "baseline_run_id": "eval-20260503T120838Z-agentops-core.hook-manifest-runtime-contracts",
    "baseline_path": "/home/boful/dev/personal/agentops/.agents/evals/baselines/agentops-core.hook-manifest-runtime-contracts.baseline.json",
    "promoted_from_run_id": "eval-20260503T120838Z-agentops-core.hook-manifest-runtime-contracts",
    "promoted_at": "2026-05-03T12:13:50.668274902Z",
    "promoted_by": "evolve-cycle-16",
    "rationale": "bulk catch-up after suite-definition drift accumulated through 2026-04-25 to 2026-05-03; all 57 suites verified passing in mid-baseline pass; cycles 14+15 fixed the 3 prior outliers (skill-catalog, eval-runner-cli-docs, distribution-install-update transitive)"
  },
  "case_results": [
    {
      "id": "hook-preflight-and-orphan-audit",
      "status": "pass",
      "score": 1,
      "dimension_scores": {
        "correctness": 1,
        "process_adherence": 1,
        "safety": 1
      },
      "duration_ms": 468,
      "critical": true,
      "diagnostics": [
        "exit_code matched 0",
        "stdout contains \"Hook preflight PASSED\"",
        "stdout contains \"Registered: 36 of 51\"",
        "stdout contains \"Unregistered: 15\"",
        "stdout contains \"JSON-emitting (WARNING): 0\"",
        "stdout contains \"context-guard.sh\"",
        "stdout contains \"precompact-snapshot.sh\"",
        "stdout contains \"ratchet-advance.sh\"",
        "stdout contains \"standards-injector.sh\""
      ]
    },
    {
      "id": "hook-stdin-output-bats-contracts",
      "status": "pass",
      "score": 1,
      "dimension_scores": {
        "correctness": 1,
        "runtime_compatibility": 1,
        "safety": 1
      },
      "duration_ms": 13812,
      "critical": true,
      "diagnostics": [
        "exit_code matched 0",
        "stdout contains \"1..122\"",
        "stdout contains \"ok 24 cross-check: all hooks.json registered hooks that emit JSON use hookSpecificOutput wrapper\"",
        "stdout contains \"ok 39 dangerous-git-guard: force push blocked with exit 2\"",
        "stdout contains \"ok 50 codex-parity-warn: shared skill edit emits parity warning\"",
        "stdout contains \"ok 122 task-validation-gate: empty stdin exits gracefully\""
      ]
    },
    {
      "id": "hook-manifest-command-inventory",
      "status": "pass",
      "score": 1,
      "dimension_scores": {
        "artifact_quality": 1,
        "process_adherence": 1,
        "safety": 1
      },
      "critical": true,
      "diagnostics": [
        "artifact ../../hooks/hooks.json contains \"\\\"SessionStart\\\"\"",
        "artifact ../../hooks/hooks.json contains \"\\\"SessionEnd\\\"\"",
        "artifact ../../hooks/hooks.json contains \"\\\"UserPromptSubmit\\\"\"",
        "artifact ../../hooks/hooks.json contains \"\\\"PreToolUse\\\"\"",
        "artifact ../../hooks/hooks.json contains \"\\\"PostToolUse\\\"\"",
        "artifact ../../hooks/hooks.json contains \"\\\"TaskCompleted\\\"\"",
        "artifact ../../hooks/hooks.json contains \"session-start.sh\"",
        "artifact ../../hooks/hooks.json contains \"dangerous-git-guard.sh\"",
        "artifact ../../hooks/hooks.json contains \"session-end-maintenance.sh\"",
        "artifact ../../hooks/hooks.json contains \"compile-session-defrag.sh\"",
        "artifact ../../hooks/hooks.json contains \"factory-router.sh\"",
        "artifact ../../hooks/hooks.json contains \"quality-signals.sh\"",
        "artifact ../../hooks/hooks.json contains \"pre-mortem-gate.sh\"",
        "artifact ../../hooks/hooks.json contains \"commit-review-gate.sh\"",
        "artifact ../../hooks/hooks.json contains \"git-worker-guard.sh\"",
        "artifact ../../hooks/hooks.json contains \"lead-only-worker-git-guard.sh\"",
        "artifact ../../hooks/hooks.json contains \"holdout-isolation-gate.sh\"",
        "artifact ../../hooks/hooks.json contains \"write-time-quality.sh\"",
        "artifact ../../hooks/hooks.json contains \"go-complexity-precommit.sh\"",
        "artifact ../../hooks/hooks.json contains \"go-vet-post-edit.sh\"",
        "artifact ../../hooks/hooks.json contains \"research-loop-detector.sh\"",
        "artifact ../../hooks/hooks.json contains \"task-validation-gate.sh\""
      ]
    },
    {
      "id": "hook-manifest-command-counts",
      "status": "pass",
      "score": 1,
      "dimension_scores": {
        "artifact_quality": 1,
        "correctness": 1
      },
      "duration_ms": 4,
      "critical": true,
      "diagnostics": [
        "exit_code matched 0",
        "stdout contains \"hook-manifest-counts-ok\""
      ]
    },
    {
      "id": "codex-hook-runtime-subset",
      "status": "pass",
      "score": 1,
      "dimension_scores": {
        "artifact_quality": 1,
        "process_adherence": 1,
        "runtime_compatibility": 1
      },
      "critical": true,
      "diagnostics": [
        "artifact ../../hooks/codex-hooks.json contains \"\\\"matcher\\\": \\\"startup|resume\\\"\"",
        "artifact ../../hooks/codex-hooks.json contains \"session-start.sh\"",
        "artifact ../../hooks/codex-hooks.json contains \"ao-flywheel-close.sh\"",
        "artifact ../../hooks/codex-hooks.json contains \"prompt-nudge.sh\"",
        "artifact ../../hooks/codex-hooks.json contains \"quality-signals.sh\"",
        "artifact ../../hooks/codex-hooks.json contains \"go-test-precommit.sh\"",
        "artifact ../../hooks/codex-hooks.json contains \"commit-review-gate.sh\"",
        "artifact ../../hooks/codex-hooks.json contains \"ratchet-advance.sh\"",
        "artifact ../../hooks/codex-hooks.json contains \"${AGENTOPS_PLUGIN_ROOT:-~/.codex/plugins/cache/agentops}\""
      ]
    },
    {
      "id": "embedded-hook-inventory-parity",
      "status": "pass",
      "score": 1,
      "dimension_scores": {
        "artifact_quality": 1,
        "process_adherence": 1,
        "runtime_compatibility": 1
      },
      "duration_ms": 8,
      "critical": true,
      "diagnostics": [
        "exit_code matched 0",
        "stdout contains \"embedded-hooks-in-sync\""
      ]
    }
  ],
  "aggregate_score": 1,
  "dimension_scores": {
    "artifact_quality": 1,
    "correctness": 1,
    "process_adherence": 1,
    "runtime_compatibility": 1,
    "safety": 1
  },
  "artifacts": [
    {
      "path": ".agents/evolve/baselines/20260503T120414Z-mid/hook-manifest-runtime-contracts.json",
      "purpose": "evaluation run record",
      "kind": "run_json"
    },
    {
      "path": "/home/boful/dev/personal/agentops/.agents/evals/baselines/agentops-core.hook-manifest-runtime-contracts.baseline.json",
      "purpose": "promoted eval baseline",
      "kind": "baseline"
    }
  ]
}
