{
  "schema_version": 1,
  "run_id": "agentops-core.docs-release-governance-20260429T030633Z",
  "suite": {
    "id": "agentops-core.docs-release-governance",
    "path": "evals/agentops-core/docs-release-governance.json",
    "visibility": "public_canary",
    "tier": "deterministic",
    "sha256": "78c6b9cbf39e1a8bf61da049dd7bd47ddbff5e1229830991ad6bf852923b2d0f"
  },
  "started_at": "2026-04-29T03:07:04.073082Z",
  "completed_at": "2026-04-29T03:07:07.982164Z",
  "status": "pass",
  "verdict": "pass",
  "git": {
    "candidate_ref": "main",
    "candidate_sha": "86a822bb4410",
    "dirty": true,
    "dirty_paths": [
      ".agents/rpi/execution-packet.json",
      ".agents/rpi/ranked-packet.json",
      "cli/cmd/ao/agentopsd.go",
      "cli/cmd/ao/agentopsd_test.go",
      "cli/cmd/ao/cobra_commands_test.go",
      "cli/cmd/ao/compile.go",
      "cli/cmd/ao/doctor.go",
      "cli/cmd/ao/doctor_product_runtime_test.go",
      "cli/cmd/ao/dream_subcycle.go",
      "cli/cmd/ao/forge.go",
      "cli/cmd/ao/forge_tier1_test.go",
      "cli/cmd/ao/gc_bridge.go",
      "cli/cmd/ao/gc_bridge_test.go",
      "cli/cmd/ao/overnight.go",
      "cli/cmd/ao/overnight_curator.go",
      "cli/cmd/ao/overnight_daemon.go",
      "cli/cmd/ao/overnight_daemon_test.go",
      "cli/cmd/ao/overnight_tier1_test.go",
      "cli/cmd/ao/rpi_integration_test.go",
      "cli/cmd/ao/rpi_phased.go",
      "cli/cmd/ao/rpi_phased_context.go",
      "cli/cmd/ao/rpi_phased_daemon.go",
      "cli/cmd/ao/rpi_phased_daemon_test.go",
      "cli/cmd/ao/rpi_phased_gc.go",
      "cli/cmd/ao/rpi_phased_gc_test.go",
      "cli/cmd/ao/rpi_phased_stream.go",
      "cli/cmd/ao/rpi_status.go",
      "cli/cmd/ao/rpi_status_daemon_test.go",
      "cli/cmd/ao/rpi_verify.go",
      "cli/cmd/ao/rpi_verify_test.go",
      "cli/docs/COMMANDS.md",
      "cli/embedded/skills/compile/scripts/compile.sh",
      "cli/internal/agentworker/",
      "cli/internal/bridge/gc.go",
      "cli/internal/daemon/",
      "cli/internal/gascity/",
      "cli/internal/llm/forge_tier1.go",
      "cli/internal/llm/forge_tier1_test.go",
      "cli/internal/llm/model_executor.go",
      "cli/internal/llm/model_executor_test.go",
      "cli/internal/llm/ollama_client.go",
      "cli/internal/openclaw/",
      "cli/internal/overnight/checkpoint.go",
      "cli/internal/overnight/commit.go",
      "cli/internal/overnight/fitness.go",
      "cli/internal/overnight/fitness_test.go",
      "cli/internal/overnight/ingest.go",
      "cli/internal/overnight/loop.go",
      "cli/internal/overnight/measure.go",
      "cli/internal/overnight/reduce.go",
      "cli/internal/overnight/stages_test.go",
      "cli/internal/rpi/artifacts.go",
      "cli/internal/rpi/artifacts_test.go",
      "cli/internal/rpi/registry.go",
      "cli/internal/rpi/registry_test.go",
      "cli/internal/rpi/types.go",
      "cli/internal/rpi/types_test.go",
      "cli/internal/wikiworker/",
      "docs/UPGRADING.md",
      "docs/cli-skills-map.md",
      "docs/cli-surface.json",
      "docs/cli-surface.md",
      "docs/contracts/agent-worker.md",
      "docs/contracts/agentops-daemon.md",
      "docs/contracts/agents-write-surfaces.md",
      "docs/contracts/dream-run-contract.md",
      "docs/contracts/examples/",
      "docs/contracts/gascity-integration.md",
      "docs/contracts/index.md",
      "docs/contracts/openclaw-consumer-api.md",
      "docs/contracts/rpi-run-registry.md",
      "docs/daemon-migration.md",
      "docs/documentation-index.md",
      "evals/agentops-core/cli-command-surface-matrix.json",
      "evals/agentops-core/fixtures/cli-command-surface-smoke.sh",
      "mkdocs.yml",
      "scripts/check-closeout-gate.sh",
      "scripts/validate-daemon-product-e2e.sh",
      "tests/scripts/test-closeout-gate.sh",
      "tests/scripts/test-daemon-product-e2e.sh"
    ]
  },
  "runtime": {
    "name": "shell",
    "live": false,
    "attempts": 1,
    "timeout_seconds": 240
  },
  "environment": {
    "scrubbed_env_prefixes": [
      "AGENTOPS_RPI_RUNTIME",
      "ANTHROPIC_",
      "OPENAI_"
    ],
    "isolated_home": false,
    "isolated_codex_home": false,
    "network_access": "disabled"
  },
  "baseline": {
    "mode": "none"
  },
  "case_results": [
    {
      "id": "doc-release-stabilization-gate",
      "status": "pass",
      "score": 1,
      "dimension_scores": {
        "artifact_quality": 1,
        "correctness": 1,
        "process_adherence": 1
      },
      "duration_ms": 3429,
      "critical": true,
      "diagnostics": [
        "exit_code matched 0",
        "stdout contains \"PASS: Link validation\"",
        "stdout contains \"PASS: Skill count validation\"",
        "stdout contains \"PASS: CLI skills map validation\"",
        "stdout contains \"PASS: release message freeze intact\"",
        "stdout contains \"PASS: doc-release gate succeeded\""
      ]
    },
    {
      "id": "docs-policy-parity-gates",
      "status": "pass",
      "score": 1,
      "dimension_scores": {
        "artifact_quality": 1,
        "correctness": 1,
        "process_adherence": 1
      },
      "duration_ms": 195,
      "critical": true,
      "diagnostics": [
        "exit_code matched 0",
        "stdout contains \"HOOKS_DOC_PARITY: PASS\"",
        "stdout contains \"CI_POLICY_PARITY: PASS\"",
        "stdout contains \"CLI_SKILLS_MAP: PASS\"",
        "stdout contains \"DONE: All counts already in sync.\""
      ]
    },
    {
      "id": "docs-readme-oss-skill-validators",
      "status": "pass",
      "score": 1,
      "dimension_scores": {
        "correctness": 1,
        "process_adherence": 1,
        "runtime_compatibility": 1
      },
      "duration_ms": 113,
      "critical": true,
      "diagnostics": [
        "exit_code matched 0",
        "stdout contains \"Results: 5 passed, 0 failed\"",
        "stdout contains \"Results: 2 passed, 0 failed\"",
        "stdout contains \"PASS: OSS-docs skill validation passed\""
      ]
    },
    {
      "id": "oss-docs-audit-json-behavior",
      "status": "pass",
      "score": 1,
      "dimension_scores": {
        "artifact_quality": 1,
        "correctness": 1,
        "runtime_compatibility": 1
      },
      "duration_ms": 169,
      "critical": true,
      "diagnostics": [
        "exit_code matched 0",
        "stdout contains \"oss-docs-json-ok\""
      ]
    },
    {
      "id": "source-backed-documentation-contracts",
      "status": "pass",
      "score": 1,
      "dimension_scores": {
        "artifact_quality": 1,
        "process_adherence": 1,
        "safety": 1
      },
      "critical": true,
      "diagnostics": [
        "artifact ../../skills/doc/SKILL.md contains \"Validate existing docs are current\"",
        "artifact ../../skills/doc/SKILL.md contains \"**Validate existing** - docs can go stale\"",
        "artifact ../../skills/doc/references/validation-rules.md contains \"Establish ONE authoritative file per domain. Other docs MUST reference, not duplicate.\"",
        "artifact ../../skills/doc/references/validation-rules.md contains \"When running `/doc coverage --verify-claims`\"",
        "artifact ../../skills-codex/doc/prompt.md contains \"Prefer source-backed updates, doc-gap findings, and validation commands over generic prose.\"",
        "artifact ../../skills/readme/SKILL.md contains \"Assertions without evidence trigger hostility.\"",
        "artifact ../../skills/readme/SKILL.md contains \"Trust block near install\"",
        "artifact ../../skills-codex/readme/prompt.md contains \"Validate claims against the repo before presenting the draft as ready.\""
      ]
    },
    {
      "id": "doc-release-script-contracts",
      "status": "pass",
      "score": 1,
      "dimension_scores": {
        "artifact_quality": 1,
        "process_adherence": 1,
        "safety": 1
      },
      "critical": true,
      "diagnostics": [
        "artifact ../../tests/docs/validate-doc-release.sh contains \"run_check \\\"Link validation\\\"\"",
        "artifact ../../tests/docs/validate-doc-release.sh contains \"run_check \\\"Skill count sync check\\\"\"",
        "artifact ../../tests/docs/validate-doc-release.sh contains \"run_check \\\"CLI skills map validation\\\"\"",
        "artifact ../../tests/docs/validate-doc-release.sh contains \"run_check \\\"Release message freeze validation\\\"\"",
        "artifact ../../scripts/sync-skill-counts.sh contains \"pattern not found (fail-closed)\"",
        "artifact ../../scripts/validate-cli-skills-map.sh contains \"top audit line must declare '\u003cN\u003e generated CLI command headings'\"",
        "artifact ../../scripts/validate-hooks-doc-parity.sh contains \"Runtime manifest active hook events\"",
        "artifact ../../scripts/validate-ci-policy-parity.sh contains \"CI_POLICY_PARITY: PASS\""
      ]
    }
  ],
  "aggregate_score": 1,
  "dimension_scores": {
    "artifact_quality": 1,
    "correctness": 1,
    "process_adherence": 1,
    "runtime_compatibility": 1,
    "safety": 1
  },
  "artifacts": [
    {
      "path": ".agents/evals/runs/a9-8-targeted-20260429T030632Z/20260429T030633Z/agentops-core.docs-release-governance.run.json",
      "purpose": "evaluation run record",
      "kind": "run_json"
    }
  ]
}
