{
  "schema_version": 1,
  "run_id": "eval-20260503T120958Z-agentops-core.runtime-smoke-matrix",
  "suite": {
    "id": "agentops-core.runtime-smoke-matrix",
    "path": "/home/boful/dev/personal/agentops/evals/agentops-core/runtime-smoke-matrix.json",
    "visibility": "public_canary",
    "tier": "deterministic",
    "sha256": "c8555c4bc4f3b5694fed51acd4563018d17cf1d81a1bf36cdb9ba16ec04ed28f"
  },
  "started_at": "2026-05-03T12:09:58.981700971Z",
  "completed_at": "2026-05-03T12:10:01.838963143Z",
  "status": "pass",
  "verdict": "pass",
  "git": {
    "candidate_ref": "main",
    "candidate_sha": "ad754badb8f3",
    "dirty": true,
    "dirty_paths": [
      ".agents/rpi/next-work.jsonl"
    ]
  },
  "runtime": {
    "name": "shell",
    "live": false,
    "attempts": 1,
    "timeout_seconds": 120
  },
  "environment": {
    "scrubbed_env_prefixes": [
      "AGENTOPS_RPI_RUNTIME",
      "ANTHROPIC_",
      "OPENAI_"
    ],
    "isolated_home": false,
    "isolated_codex_home": false,
    "network_access": "disabled"
  },
  "baseline": {
    "mode": "promote",
    "baseline_run_id": "eval-20260503T120958Z-agentops-core.runtime-smoke-matrix",
    "baseline_path": "/home/boful/dev/personal/agentops/.agents/evals/baselines/agentops-core.runtime-smoke-matrix.baseline.json",
    "promoted_from_run_id": "eval-20260503T120958Z-agentops-core.runtime-smoke-matrix",
    "promoted_at": "2026-05-03T12:13:52.028793151Z",
    "promoted_by": "evolve-cycle-16",
    "rationale": "bulk catch-up after suite-definition drift accumulated through 2026-04-25 to 2026-05-03; all 57 suites verified passing in mid-baseline pass; cycles 14+15 fixed the 3 prior outliers (skill-catalog, eval-runner-cli-docs, distribution-install-update transitive)"
  },
  "case_results": [
    {
      "id": "claude-code-runtime-smoke",
      "status": "pass",
      "score": 1,
      "dimension_scores": {
        "artifact_quality": 1,
        "correctness": 1,
        "runtime_compatibility": 1
      },
      "duration_ms": 1165,
      "critical": true,
      "diagnostics": [
        "exit_code matched 0",
        "stdout contains \"Proof tier: Tier S structural/install smoke\"",
        "stdout contains \"0 failed\""
      ]
    },
    {
      "id": "codex-runtime-smoke",
      "status": "pass",
      "score": 1,
      "dimension_scores": {
        "artifact_quality": 1,
        "correctness": 1,
        "runtime_compatibility": 1,
        "safety": 1
      },
      "duration_ms": 1089,
      "critical": true,
      "diagnostics": [
        "exit_code matched 0",
        "stdout contains \"Proof tier: Tier S structural/install smoke\"",
        "stdout contains \"0 failed\""
      ]
    },
    {
      "id": "cursor-runtime-smoke",
      "status": "pass",
      "score": 1,
      "dimension_scores": {
        "artifact_quality": 1,
        "correctness": 1,
        "runtime_compatibility": 1
      },
      "duration_ms": 461,
      "critical": true,
      "diagnostics": [
        "exit_code matched 0",
        "stdout contains \"Proof tier: Tier S structural/export smoke\"",
        "stdout contains \"0 failed\""
      ]
    },
    {
      "id": "opencode-runtime-smoke",
      "status": "pass",
      "score": 1,
      "dimension_scores": {
        "artifact_quality": 1,
        "correctness": 1,
        "runtime_compatibility": 1
      },
      "duration_ms": 139,
      "critical": true,
      "diagnostics": [
        "exit_code matched 0",
        "stdout contains \"Proof tier: Tier S structural/install smoke\"",
        "stdout contains \"0 failed\""
      ]
    },
    {
      "id": "runtime-proof-matrix-contract",
      "status": "pass",
      "score": 1,
      "dimension_scores": {
        "artifact_quality": 1,
        "process_adherence": 1,
        "runtime_compatibility": 1
      },
      "critical": true,
      "diagnostics": [
        "artifact ../../PRODUCT.md contains \"Claude Code, Codex CLI, Cursor, and OpenCode\"",
        "artifact ../../PRODUCT.md contains \"Tier S structural/install proof is active for all four runtimes\"",
        "artifact ../../tests/smoke-test.sh contains \"test-runtime-claude-code-smoke.sh\"",
        "artifact ../../tests/smoke-test.sh contains \"test-runtime-codex-smoke.sh\"",
        "artifact ../../tests/smoke-test.sh contains \"test-runtime-cursor-smoke.sh\"",
        "artifact ../../tests/smoke-test.sh contains \"test-runtime-opencode-smoke.sh\""
      ]
    }
  ],
  "aggregate_score": 1,
  "dimension_scores": {
    "artifact_quality": 1,
    "correctness": 1,
    "process_adherence": 1,
    "runtime_compatibility": 1,
    "safety": 1
  },
  "artifacts": [
    {
      "path": ".agents/evolve/baselines/20260503T120414Z-mid/runtime-smoke-matrix.json",
      "purpose": "evaluation run record",
      "kind": "run_json"
    },
    {
      "path": "/home/boful/dev/personal/agentops/.agents/evals/baselines/agentops-core.runtime-smoke-matrix.baseline.json",
      "purpose": "promoted eval baseline",
      "kind": "baseline"
    }
  ]
}
